{
  "schema": "stegverse.fi-transition-continuity-interop.canonical-execution-evidence.v1",
  "suite_id": "fi-transition-continuity-interoperability-v0.1",
  "repository": "Data-Continuation/formalism-tests",
  "issue": 4,
  "status": "VERIFIED_CANONICAL_RUN",
  "authority_posture": "CONTINUITY_INTEROPERABILITY_ONLY",
  "commit_sha": "8d8cf3cdd99050afdba9b64ad3eca46b9babe13e",
  "execution_surface": "GITHUB_ACTIONS",
  "commands": [
    "python tools/run_declared_tasks.py tools/tasks/fi_transition_continuity_interop_tasks.json --task-id fi_transition_continuity_interop_tests",
    "python tools/run_declared_tasks.py tools/tasks/fi_transition_continuity_interop_tasks.json --task-id verify_fi_transition_continuity_interop_artifacts",
    "python tools/run_declared_tasks.py tools/tasks/fi_transition_continuity_interop_tasks.json --task-id check_fi_transition_continuity_interop_canonical_evidence_gate"
  ],
  "task_results": {
    "fi_transition_continuity_interop_tests": "PASS",
    "verify_fi_transition_continuity_interop_artifacts": "PASS",
    "check_fi_transition_continuity_interop_canonical_evidence_gate": "PASS"
  },
  "artifact_hashes": {
    "report_sha256": "65589a464b8a876240e1a28858c7aa1ecfbad811c99bdb06a344dee71ac2a283",
    "artifact_verification_sha256": "f573c427225eb5c4d40486c8d6892c8cc2c229470e390cc867d7128333ebc622",
    "canonical_evidence_gate_sha256": "881bf74be4a2a117919ec4044a3c99fb163fdbb266b4824b5119725985167243"
  },
  "artifact_equivalence": {
    "report": true,
    "expected_outcomes": true,
    "canonical_evidence_gate": true
  }
}
